"reply_text","order","id","created_date","updated_date","created_by_id","created_by","is_sample"
"You have submitted the old file again. Please do not resubmit the previous file","5","69d506acde0a4b34a666f45f","2026-04-07T13:29:16.019000","2026-04-07T13:29:16.019000","anonymous","anonymous","false"
"You have submitted an incomplete task. Please complete the entire task and then resubmit the file.","4","69d5065d12c5e39ddef0133a","2026-04-07T13:27:57.781000","2026-04-07T13:27:57.781000","anonymous","anonymous","false"
"You have made several mistakes in the task. Please review your report file carefully.","3","69d506262f542d0ea64c4b2b","2026-04-07T13:27:02.478000","2026-04-07T13:27:02.478000","anonymous","anonymous","false"
"It appears that you have used a third-party extension or tool to copy and paste content into the task instead of typing it manually, which is against our guidelines. This is considered suspicious activity and may lead to strict action. Your account could be suspended or permanently banned if such behavior continues.","2","69d505eb74623c41c76600bb","2026-04-07T13:26:03.507000","2026-04-07T13:26:03.507000","anonymous","anonymous","false"
"You have not provided access to the Google Drive file, which is why we are unable to open it. Please grant the necessary permissions and resubmit the file.","1","69d5056040c52b37b2620b5f","2026-04-07T13:23:44.195000","2026-04-07T13:23:44.195000","anonymous","anonymous","false"